{
  "$schema": "../schemas/agent-runtime.schema.json",
  "schema_version": 1,
  "owner": "agent-runtime",
  "purpose": "Declares runtime-specific facts (skill discovery path, skill load model) for each AI-coding runtime the kit targets. Single authoritative source so prose across skills and adapters stops drifting from live docs.",
  "authoritative": true,
  "generated_from": {
    "subagent": "agent-runtime",
    "run_at": null,
    "kit_version": "1.4.0"
  },
  "last_validated_at": "2026-04-19T00:00:00Z",
  "status": "active",
  "runtimes": [
    {
      "id": "claude-code",
      "display_name": "Claude Code (Anthropic)",
      "skill_discovery_path": ".claude/skills/<name>/SKILL.md",
      "skill_load_model": "Skill directories watched from session start; adding, editing, or removing a skill inside an already-watched directory takes effect within the current session without restart; creating a top-level skills directory that did not exist at session start requires restarting Claude Code so the new directory can be watched.",
      "docs_url": "https://code.claude.com/docs/en/skills",
      "retrieved_at": "2026-04-19",
      "requires_reload_after": [
        "new top-level skills directory created"
      ]
    },
    {
      "id": "cursor",
      "display_name": "Cursor",
      "skill_discovery_path": ".cursor/rules/",
      "skill_load_model": "Rules files loaded at session start; edits require session restart.",
      "docs_url": "",
      "retrieved_at": "2026-04-19",
      "requires_reload_after": [
        "rules file added or modified"
      ]
    },
    {
      "id": "codex",
      "display_name": "Codex (OpenAI)",
      "skill_discovery_path": "unknown",
      "skill_load_model": "unknown \u2014 requires live research",
      "docs_url": "",
      "retrieved_at": "2026-04-19",
      "requires_reload_after": []
    }
  ]
}
